<?xml version="1.0" encoding="UTF-8"?>

<pointsList
        xmlns="http://www.it-academy.by"
        xmlns:xsi="http://www.w3.org/2001/XMLSchema-instance"
        xsi:schemaLocation="http://www.it-academy.by pl.xsd">
    <point unit="cm">
        <x>2</x>
        <y>3</y>
    </point>
    <point unit="mm">
        <x>9</x>
        <y>3</y>
    </point>
    <point unit="px">
        <x>5</x>
        <y>6</y>
    </point>
</pointsList>